{
    "$schema": "http://json-schema.org/draft-07/schema#",
    "title": "Prompt Chain",
    "type": "object",
    "properties": {
      "chain_id": {
        "type": "string",
        "description": "Unique identifier for the prompt chain."
      },
      "chain_title": {
        "type": "string",
        "description": "Title of the prompt chain."
      },
      "chain_description": {
        "type": "string",
        "description": "Description of the prompt chain's purpose."
      },
      "version": {
        "type": "string",
        "description": "Version of the prompt chain."
      },
      "prompts": {
        "type": "array",
        "items": {
          "$ref": "#/definitions/prompt"
        }
      }
    },
    "required": ["chain_id", "chain_title", "prompts"],
    "definitions": {
      "prompt": {
        "type": "object",
        "properties": {
          "prompt_id": {
            "type": "string",
            "description": "Unique identifier for the prompt."
          },
          "prompt_text": {
            "type": "string",
            "description": "The text of the prompt to be sent."
          },
          "response_type": {
            "type": "string",
            "enum": ["text", "json"],
            "description": "Expected response type."
          },
          "dependencies": {
            "type": "array",
            "items": {
              "type": "string"
            },
            "description": "List of dependencies that this prompt relies on."
          },
          "parameters": {
            "type": "object",
            "additionalProperties": true,
            "description": "Parameters that can be passed into the prompt."
          },
          "user_interaction": {
            "type": "object",
            "properties": {
              "required": {
                "type": "boolean",
                "description": "Indicates if user interaction is required."
              },
              "interaction_type": {
                "type": "string",
                "enum": ["choice", "edit"],
                "description": "Type of user interaction required."
              },
              "options": {
                "type": "array",
                "items": {
                  "type": "string"
                }
              }
            },
            "description": "Details about user interaction if required."
          },
          "external_service": {
            "type": "string",
            "enum": ["google_search", "dalle", "other_api"],
            "description": "Name of external service to integrate with the prompt."
          }
        },
        "required": ["prompt_id", "prompt_text", "response_type"]
      }
    }
  }
  