{
    "chain_id": "webpage_creation_chain_001",
    "chain_title": "Webpage Content Creation",
    "chain_description": "Chain for creating structured content for a webpage.",
    "version": "1.0.0",
    "prompts": [
      {
        "prompt_id": "content_outline",
        "prompt_text": "Generate an outline for a webpage about {{ topic }}.",
        "response_type": "json",
        "dependencies": [],
        "parameters": {
          "topic": "Sustainable Gardening"
        }
      },
      {
        "prompt_id": "select_outline",
        "prompt_text": "Please select the most appropriate outline for the webpage.",
        "response_type": "text",
        "user_interaction": {
          "required": true,
          "interaction_type": "choice",
          "options": ["Outline 1", "Outline 2", "Outline 3"]
        }
      },
      {
        "prompt_id": "detail_section",
        "prompt_text": "Elaborate on the section titled '{{ section_title }}' from the chosen outline.",
        "response_type": "text",
        "dependencies": ["select_outline"],
        "parameters": {
          "section_title": "Introduction to Sustainable Practices"
        }
      },
      {
        "prompt_id": "external_data_inclusion",
        "prompt_text": "Include statistics from the Google Search API to support the claims in the 'Benefits' section.",
        "response_type": "json",
        "dependencies": ["detail_section"],
        "external_service": "google_search"
      }
    ]
  }
  